{
  "schemaVersion": "0.1.0",
  "kind": "portable-profile-export",
  "exportId": "export_fixture_adjacent",
  "profileVersion": "profile_fixture_adjacent",
  "subjectRef": "subject_fixture_owner",
  "generatedAt": "2026-09-05T12:00:00Z",
  "profile": {
    "projectRefs": [],
    "evidence": [
      {
        "schemaVersion": "0.1.0",
        "evidenceId": "evidence_fixture_java_adjacent",
        "kind": "observation",
        "capabilitySignal": "language.java",
        "source": {
          "class": "selected-local-repository",
          "sourceRelativeRef": "src/Adjacent.java",
          "repositoryRef": "repository_fixture_adjacent",
          "revisionRef": "revision_fixture_adjacent",
          "visibility": "local-only"
        },
        "authorAssessment": {
          "state": "attributed",
          "subjectRef": "subject_fixture_owner"
        },
        "freshness": {
          "observedAt": "2026-09-01T00:00:00Z",
          "collectedAt": "2026-09-02T00:00:00Z"
        },
        "strength": "moderate",
        "limitations": [],
        "extractor": {
          "name": "fixture.collector",
          "version": "0.1.0"
        },
        "invalidation": {
          "rule": "source-changed",
          "fingerprint": "fingerprint_fixture_adjacent"
        }
      }
    ],
    "claims": [
      {
        "schemaVersion": "0.1.0",
        "claimId": "claim_fixture_kotlin_adjacent",
        "capability": "language.kotlin",
        "state": "adjacent",
        "observedDepth": null,
        "confidence": "medium",
        "scope": "global",
        "projectRef": null,
        "basis": {
          "kind": "adjacency",
          "evidenceRefs": ["evidence_fixture_java_adjacent"],
          "adjacentFrom": ["language.java"],
          "rationale": "The synthetic source capability shares JVM concepts",
          "declarationRef": null,
          "correctionRef": null,
          "correctionSummary": null
        },
        "limitations": ["Adjacent experience is not observed Kotlin proficiency"],
        "freshness": {
          "observedThrough": "2026-09-01T00:00:00Z",
          "stale": false
        }
      }
    ],
    "declarations": [],
    "corrections": [],
    "preferences": {
      "explanationMode": "balanced",
      "explainPurposeBeforeCommands": true,
      "includeExpectedResult": true,
      "includeRiskAndRollback": true,
      "questionBudget": 1
    }
  },
  "exclusions": {
    "credentials": true,
    "rawSource": true,
    "sourceGrants": true,
    "sharingGrants": true,
    "internalState": true
  }
}
