{
  "schemaVersion": "0.1.0",
  "kind": "portable-profile-export",
  "exportId": "export_fixture_insufficient",
  "profileVersion": "profile_fixture_insufficient",
  "subjectRef": "subject_fixture_owner",
  "generatedAt": "2026-09-05T12:00:00Z",
  "profile": {
    "projectRefs": [],
    "evidence": [],
    "claims": [
      {
        "schemaVersion": "0.1.0",
        "claimId": "claim_fixture_ci_insufficient",
        "capability": "delivery.ci.github-actions",
        "state": "insufficient-evidence",
        "observedDepth": null,
        "confidence": "low",
        "scope": "global",
        "projectRef": null,
        "basis": {
          "kind": "insufficient-evidence",
          "evidenceRefs": [],
          "adjacentFrom": [],
          "rationale": null,
          "declarationRef": null,
          "correctionRef": null,
          "correctionSummary": null
        },
        "limitations": ["No stronger synthetic evidence is available"],
        "freshness": {
          "observedThrough": null,
          "stale": false
        }
      }
    ],
    "declarations": [],
    "corrections": [],
    "preferences": {
      "explanationMode": "balanced",
      "explainPurposeBeforeCommands": true,
      "includeExpectedResult": true,
      "includeRiskAndRollback": true,
      "questionBudget": 1
    }
  },
  "exclusions": {
    "credentials": true,
    "rawSource": true,
    "sourceGrants": true,
    "sharingGrants": true,
    "internalState": true
  }
}
